date,company,position,tags,url
,,,,
2025-10-24T11:00:05+00:00,Tech Innovations Inc.,Software Engineer,"software, code, engineer",https://remoteOK.com/remote-jobs/remote-software-engineer-tech-innovations-inc-1128584
2025-10-24T10:28:19+00:00,Octo Horizon,Software Engineer C+,"dev, engineer, technical, cloud",https://remoteOK.com/remote-jobs/remote-software-engineer-c-octo-horizon-1128583
2025-10-24T00:05:10+00:00,Braeburn,Key Account Manager Seattle S WA AK,"manager, management, sales, healthcare, non tech",https://remoteOK.com/remote-jobs/remote-key-account-manager-seattle-s-wa-ak-braeburn-1128582
2025-10-24T00:04:52+00:00,Invisible Agency,Infra DevOps Engineer Specialist,"technical, software, devops, cloud, engineer, engineering",https://remoteOK.com/remote-jobs/remote-infra-devops-engineer-specialist-invisible-agency-1128581
2025-10-24T00:04:39+00:00,Invisible Agency,Backend Engineer Specialist,"cloud, engineer, backend",https://remoteOK.com/remote-jobs/remote-backend-engineer-specialist-invisible-agency-1128580
2025-10-24T00:04:27+00:00,174 Power Global,Senior Manager Estimation,"manager, ceo, support, travel, management, lead, senior, non tech",https://remoteOK.com/remote-jobs/remote-senior-manager-estimation-174-power-global-1128579
2025-10-24T00:04:12+00:00,Right Side Up,Paid Social Growth Marketer Consultant,"consultant, growth, test, ads, strategy, marketer, marketing",https://remoteOK.com/remote-jobs/remote-paid-social-growth-marketer-consultant-right-side-up-1128578
2025-10-24T00:04:04+00:00,Doran Jones Inc.,Service Level &amp; Availability Manager,"manager, system, technical, support, cloud, management, operations, operational, analytics, reliability, health",https://remoteOK.com/remote-jobs/remote-service-level-amp-availability-manager-doran-jones-inc-1128577
2025-10-24T00:03:58+00:00,PingWind,Logistics Analyst I,"analyst, design, system, support, financial, education, management, operations, health, recruitment, digital nomad",https://remoteOK.com/remote-jobs/remote-logistics-analyst-i-pingwind-1128576
2025-10-24T00:03:51+00:00,Invisible Agency,Data Scientist Specialist,"design, software, digital nomad",https://remoteOK.com/remote-jobs/remote-data-scientist-specialist-invisible-agency-1128575
2025-10-24T00:03:39+00:00,Veeam Software,Global Compensation COE Director,"dev, director, leader, go, digital nomad",https://remoteOK.com/remote-jobs/remote-global-compensation-coe-director-veeam-software-1128574
2025-10-24T00:03:25+00:00,Sayari,Forward Deployed Engineer,"python, director, financial, investment, cloud, api, analytics, sales, engineer, engineering",https://remoteOK.com/remote-jobs/remote-forward-deployed-engineer-sayari-1128573
2025-10-24T00:03:09+00:00,Invisible Agency,Full Stack Engineer Specialist,"frontend, full-stack, developer, software, engineer, engineering, digital nomad",https://remoteOK.com/remote-jobs/remote-full-stack-engineer-specialist-invisible-agency-1128572
2025-10-24T00:02:42+00:00,3Pillar,Senior Data Engineer,"python, software, growth, code, java, cloud, nosql, management, senior, junior, analytics, health, engineer, engineering",https://remoteOK.com/remote-jobs/remote-senior-data-engineer-3pillar-1128571
2025-10-24T00:02:31+00:00,HighLevel,Director Finance Strategy &amp; Operations,"director, design, saas, architect, cfo, support, accounting, financial, investor, finance, api, strategy, management, lead, operations, operational, marketing, legal, sales, executive, digital nomad",https://remoteOK.com/remote-jobs/remote-director-finance-strategy-amp-operations-highlevel-1128570
2025-10-24T00:02:23+00:00,Retired.com,Tech Recruiter,"cryptocurrency, hr, technical, recruiter, support, software, growth, financial, fintech, lead, operations, recruiting, recruitment, branding",https://remoteOK.com/remote-jobs/remote-tech-recruiter-retired-com-1128569
2025-10-24T00:02:16+00:00,Fuze Health,Senior Project Manager Finance Fuze Health,"manager, growth, financial, finance, management, lead, senior, operations, medical, health, healthcare",https://remoteOK.com/remote-jobs/remote-senior-project-manager-finance-fuze-health-fuze-health-1128568
2025-10-24T00:02:00+00:00,CrowdGen by Appen,AI Translation Evaluator Turkish &gt; English,part-time,https://remoteOK.com/remote-jobs/remote-ai-translation-evaluator-turkish-gt-english-crowdgen-by-appen-1128567
2025-10-24T00:01:45+00:00,Kapitus,Account Executive Renewal Sales,"support, voice, management, senior, sales, executive",https://remoteOK.com/remote-jobs/remote-account-executive-renewal-sales-kapitus-1128566
2025-10-24T00:01:33+00:00,Glydways,Autonomy Software Engineer Integration,"software, design, system, support, testing, c++, engineer, digital nomad",https://remoteOK.com/remote-jobs/remote-autonomy-software-engineer-integration-glydways-1128565
2025-10-24T00:01:15+00:00,Invisible Agency,Kinyarwanda Language Specialist AI Trainer,"trainer, training",https://remoteOK.com/remote-jobs/remote-kinyarwanda-language-specialist-ai-trainer-invisible-agency-1128564
2025-10-24T00:01:03+00:00,Bisnow,Full Stack Developer,"developer, design, front-end, back-end, technical, software, code, web, marketing, sales, go, recruitment, digital nomad",https://remoteOK.com/remote-jobs/remote-full-stack-developer-bisnow-1128563
2025-10-24T00:00:56+00:00,Liquid Death,Field Sales Representative field based Dallas Fort Worth Texas,"growth, travel, marketing, sales, health",https://remoteOK.com/remote-jobs/remote-field-sales-representative-field-based-dallas-fort-worth-texas-liquid-death-1128562
2025-10-24T00:00:41+00:00,Cycle Pharmaceuticals Ltd,Speciality Distribution Manager,"manager, design, support, management, lead, full-time, digital nomad",https://remoteOK.com/remote-jobs/remote-speciality-distribution-manager-cycle-pharmaceuticals-ltd-1128561
2025-10-24T00:00:22+00:00,Aptitude 8,Project Intake Consultant,"consultant, technical, director, strategy, full-time",https://remoteOK.com/remote-jobs/remote-project-intake-consultant-aptitude-8-1128560
2025-10-23T16:05:38+00:00,mindsquare AG,SAP PP Consultant,consultant,https://remoteOK.com/remote-jobs/remote-sap-pp-consultant-mindsquare-ag-1128558
2025-10-23T16:05:23+00:00,mindsquare AG,SAP HCM Berater,,https://remoteOK.com/remote-jobs/remote-sap-hcm-berater-mindsquare-ag-1128557
2025-10-23T16:05:09+00:00,mindsquare AG,Solution Architect SAP S 4HANA Migration,architect,https://remoteOK.com/remote-jobs/remote-solution-architect-sap-s-4hana-migration-mindsquare-ag-1128556
2025-10-23T16:04:47+00:00,mindsquare AG,Consultant SAP Supply Chain Operations,"consultant, operations",https://remoteOK.com/remote-jobs/remote-consultant-sap-supply-chain-operations-mindsquare-ag-1128555
2025-10-23T16:04:31+00:00,mindsquare AG,Technical Consultant Integration PI PO Voll oder Teilzeit,"consultant, technical",https://remoteOK.com/remote-jobs/remote-technical-consultant-integration-pi-po-voll-oder-teilzeit-mindsquare-ag-1128554
2025-10-23T16:04:13+00:00,mindsquare AG,SAP SuccessFactors Consultant Employee Central,consultant,https://remoteOK.com/remote-jobs/remote-sap-successfactors-consultant-employee-central-mindsquare-ag-1128553
2025-10-23T16:03:58+00:00,mindsquare AG,Pflichtpraktikum Praxisphase zum IT Consultant,consultant,https://remoteOK.com/remote-jobs/remote-pflichtpraktikum-praxisphase-zum-it-consultant-mindsquare-ag-1128552
2025-10-23T16:03:41+00:00,mindsquare AG,SAP EWM Consultant,consultant,https://remoteOK.com/remote-jobs/remote-sap-ewm-consultant-mindsquare-ag-1128551
2025-10-23T16:03:15+00:00,mindsquare AG,SAP Entwickler RAP CAP,entwickler,https://remoteOK.com/remote-jobs/remote-sap-entwickler-rap-cap-mindsquare-ag-1128550
2025-10-23T16:02:59+00:00,mindsquare AG,SAP Technical Consultant Voll oder Teilzeit,"consultant, technical",https://remoteOK.com/remote-jobs/remote-sap-technical-consultant-voll-oder-teilzeit-mindsquare-ag-1128549
2025-10-23T16:02:43+00:00,mindsquare AG,Consultant SAP CCM CCS,consultant,https://remoteOK.com/remote-jobs/remote-consultant-sap-ccm-ccs-mindsquare-ag-1128548
2025-10-23T16:02:30+00:00,mindsquare AG,Senior SAP Pre Sales Solution Architect,"architect, senior, sales",https://remoteOK.com/remote-jobs/remote-senior-sap-pre-sales-solution-architect-mindsquare-ag-1128547
2025-10-23T16:02:15+00:00,mindsquare AG,Consultant SAP Supply Chain Growth & Portfolio,"consultant, growth",https://remoteOK.com/remote-jobs/remote-consultant-sap-supply-chain-growth-portfolio-mindsquare-ag-1128546
2025-10-23T16:02:02+00:00,mindsquare AG,Sales Consultant SAP Procurement MM Ariba,"consultant, sales, non tech",https://remoteOK.com/remote-jobs/remote-sales-consultant-sap-procurement-mm-ariba-mindsquare-ag-1128545
2025-10-23T16:01:45+00:00,mindsquare AG,Presales Consultant SAP Technology,consultant,https://remoteOK.com/remote-jobs/remote-presales-consultant-sap-technology-mindsquare-ag-1128544
2025-10-23T16:01:31+00:00,Janes,Senior Business Development Manager DACH,"manager, system, security, growth, director, senior, sales, executive",https://remoteOK.com/remote-jobs/remote-senior-business-development-manager-dach-janes-1128543
2025-10-23T16:00:54+00:00,Xero,Senior Fullstack Engineer Payments Platform,"frontend, accounting, investment, senior, engineer, backend, fullstack",https://remoteOK.com/remote-jobs/remote-senior-fullstack-engineer-payments-platform-xero-1128542
2025-10-23T16:00:37+00:00,SupplyHouse.com,Graphic Designer,"designer, growth, manager, marketing, e-commerce",https://remoteOK.com/remote-jobs/remote-graphic-designer-supplyhouse-com-1128541
2025-10-23T14:00:02+00:00,GRAX,Senior Golang Full Stack Developer,"golang, developer, salesforce, system, security, financial, senior, golang, health, engineering, digital nomad",https://remoteOK.com/remote-jobs/remote-senior-golang-full-stack-developer-grax-1128539
2025-10-23T14:00:02+00:00,Ethena Labs,Head of Platform Engineering,"design, crypto, cryptocurrency, back-end, security, technical, support, developer, growth, devops, financial, finance, cloud, leader, strategy, lead, senior, operations, engineer, engineering, digital nomad",https://remoteOK.com/remote-jobs/remote-head-of-platform-engineering-ethena-labs-1128540
2025-10-23T12:00:19+00:00,Socket,Business Development Lead Fintech,"crypto, cofounder, growth, coo, fintech, strategy, lead, operational, sales",https://remoteOK.com/remote-jobs/remote-business-development-lead-fintech-socket-1128538
2025-10-23T00:04:44+00:00,CI&amp;T,Job 25443 Senior Quality Assurance Automation Brazil,"software, test, qa, git, senior",https://remoteOK.com/remote-jobs/remote-job-25443-senior-quality-assurance-automation-brazil-ciampt-1128536
2025-10-23T00:04:37+00:00,CI&amp;T,Job 25362 Tester Junior Brazil,"tester, design, security, support, software, testing, test, web, cloud, api, junior, health, digital nomad",https://remoteOK.com/remote-jobs/remote-job-25362-tester-junior-brazil-ciampt-1128535
2025-10-23T00:04:30+00:00,Coderio,*SR DevOps Data engineer,"python, software, code, devops, cloud, engineer",https://remoteOK.com/remote-jobs/remote-sr-devops-data-engineer-coderio-1128534
2025-10-23T00:04:23+00:00,Datavant,Job,,https://remoteOK.com/remote-jobs/remote-job-datavant-1128533
2025-10-23T00:03:51+00:00,Industrial Electric Manufacturing,Talent Management Director,"director, design, technical, support, leader, strategy, management, lead, sales, digital nomad",https://remoteOK.com/remote-jobs/remote-talent-management-director-industrial-electric-manufacturing-1128532
2025-10-23T00:03:36+00:00,Zscaler Red Canary,Senior Customer Success Manager,"manager, security, cloud, senior",https://remoteOK.com/remote-jobs/remote-senior-customer-success-manager-zscaler-red-canary-1128531
2025-10-23T00:03:10+00:00,Industrial Electric Manufacturing,Learning Program Manager,"manager, technical, growth, strategy, excel, sales",https://remoteOK.com/remote-jobs/remote-learning-program-manager-industrial-electric-manufacturing-1128530
2025-10-23T00:02:50+00:00,Pulley,Customer Success Manager,"manager, consultant, growth, finance, management, lead, operations, executive",https://remoteOK.com/remote-jobs/remote-customer-success-manager-pulley-1128529
2025-10-23T00:02:26+00:00,Mongoose,Talent &amp; People Ops Manager,"manager, design, saas, hr, support, growth, education, strategy, operations, operational, recruiting, engineering, digital nomad",https://remoteOK.com/remote-jobs/remote-talent-amp-people-ops-manager-mongoose-1128528
2025-10-23T00:02:19+00:00,Cyara,Account Executive North America New Logo,"design, saas, software, growth, voice, chatbot, management, lead, senior, sales, executive, digital nomad",https://remoteOK.com/remote-jobs/remote-account-executive-north-america-new-logo-cyara-1128527
2025-10-23T00:02:13+00:00,Federato,Data Science Manager,"manager, lead, engineering",https://remoteOK.com/remote-jobs/remote-data-science-manager-federato-1128526
2025-10-23T00:01:53+00:00,PIP Labs,Creative Producer,"design, api, management, operational, marketing, legal, digital nomad",https://remoteOK.com/remote-jobs/remote-creative-producer-pip-labs-1128525
2025-10-23T00:01:47+00:00,Industrial Electric Manufacturing,Talent Management Program Coordinator,"hr, technical, coordinator, management, sales",https://remoteOK.com/remote-jobs/remote-talent-management-program-coordinator-industrial-electric-manufacturing-1128524
2025-10-23T00:01:32+00:00,Honeycomb,Partner Marketing Manager,"manager, developer, marketing, digital nomad",https://remoteOK.com/remote-jobs/remote-partner-marketing-manager-honeycomb-1128523
2025-10-23T00:01:10+00:00,Catalyst Inc,Sales Development Associate,sales,https://remoteOK.com/remote-jobs/remote-sales-development-associate-catalyst-inc-1128522
2025-10-23T00:00:54+00:00,NPHub,Junior Copywriter,"copywriter, wordpress, students, architect, support, copywriting, voice, seo, strategy, management, content, senior, junior, marketing, health, healthcare",https://remoteOK.com/remote-jobs/remote-junior-copywriter-nphub-1128521
2025-10-23T00:00:47+00:00,Fora Financial,Engineering Manager,"manager, code, scrum, finance, financial, lead, legal, engineering",https://remoteOK.com/remote-jobs/remote-engineering-manager-fora-financial-1128520
2025-10-23T00:00:33+00:00,Ōura,Director Membership Growth & Retention,"growth, director, leader, strategy, lead, senior, health, executive",https://remoteOK.com/remote-jobs/remote-director-membership-growth-retention-oura-1128519
2025-10-23T00:00:10+00:00,Wishpond Technologies,BUSINESS DEVELOPMENT DIRECTOR,"director, design, saas, training, support, software, growth, education, leader, management, lead, senior, operations, operational, marketing, sales, executive, full-time, digital nomad",https://remoteOK.com/remote-jobs/remote-business-development-director-wishpond-technologies-1128518
2025-10-22T20:00:22+00:00,Carrot,Quality Assurance Analyst,"analyst, system, support, qa, senior, operations, health",https://remoteOK.com/remote-jobs/remote-quality-assurance-analyst-carrot-1128514
2025-10-22T19:00:27+00:00,PolicyMe,Growth Marketing Specialist,"growth, support, director, financial, video, operations, marketing, health",https://remoteOK.com/remote-jobs/remote-growth-marketing-specialist-policyme-1128513
2025-10-22T19:00:20+00:00,Unknown Worlds,Animation Lead,"game, technical, animation, lead",https://remoteOK.com/remote-jobs/remote-animation-lead-unknown-worlds-1128512
2025-10-22T17:00:18+00:00,Carrot,Care Companion I,"support, video, health, non tech",https://remoteOK.com/remote-jobs/remote-care-companion-i-carrot-1128510
2025-10-22T16:04:23+00:00,Twist Bioscience,Sr NGS Sales Specialist Boston,"technical, support, growth, financial, management, operations, sales, biology, executive",https://remoteOK.com/remote-jobs/remote-sr-ngs-sales-specialist-boston-twist-bioscience-1128509
2025-10-22T16:04:00+00:00,Acquia,Senior Software Engineer,"software, system, support, analyst, scrum, devops, java, cloud, drupal, leader, lead, senior, operations, operational, engineer",https://remoteOK.com/remote-jobs/remote-senior-software-engineer-acquia-1128508
2025-10-22T16:03:10+00:00,Vimeo,Customer Marketing Manager,"manager, design, saas, software, growth, director, video, content, senior, marketing, digital nomad",https://remoteOK.com/remote-jobs/remote-customer-marketing-manager-vimeo-1128507
2025-10-22T16:02:41+00:00,Higher Logic,Software Developer,"developer, software, design, saas, support, testing, code, mysql, engineering, digital nomad",https://remoteOK.com/remote-jobs/remote-software-developer-higher-logic-1128506
2025-10-22T16:01:32+00:00,DoiT,Manager Partner Success,"manager, growth, cloud, microsoft",https://remoteOK.com/remote-jobs/remote-manager-partner-success-doit-1128504
2025-10-22T16:01:11+00:00,Dataiku,Fullstack Software Engineer Core,"software, engineer, engineering, fullstack",https://remoteOK.com/remote-jobs/remote-fullstack-software-engineer-core-dataiku-1128503
2025-10-22T16:00:03+00:00,Coins.ph,Web Engineer,"web, design, crypto, cryptocurrencies, system, frontend, designer, software, test, growth, ux, code, javascript, financial, mobile, engineer, digital nomad",https://remoteOK.com/remote-jobs/remote-web-engineer-coins-ph-1128502
2025-10-22T15:00:56+00:00,Nansen.ai,DevOps Engineer,"system, security, code, devops, cloud, management, operations, analytics, engineer, engineering, linux",https://remoteOK.com/remote-jobs/remote-devops-engineer-nansen-ai-1128501
2025-10-22T13:00:26+00:00,CertiK,Solidity Compiler Frontend Engineer,"solidity, frontend, ethereum, security, support, java, sales, engineer, full-time",https://remoteOK.com/remote-jobs/remote-solidity-compiler-frontend-engineer-certik-1128500
2025-10-22T13:00:19+00:00,Galaxy,Lead Product Manager Crypto,"crypto, manager, web3, founder, ceo, investment, finance, leader, lead, non tech",https://remoteOK.com/remote-jobs/remote-lead-product-manager-crypto-galaxy-1128499
2025-10-22T08:17:11+00:00,Atlas Assistants,Senior Principal UX Designer — HomeOS,"senior, design, designer, figma",https://remoteOK.com/remote-jobs/remote-senior-principal-ux-designer-homeos-atlas-assistants-1128497
2025-10-22T08:00:17+00:00,Whatnot,Whatnot Job Title,,https://remoteOK.com/remote-jobs/remote-whatnot-job-title-whatnot-1128496
2025-10-22T00:06:44+00:00,OpenAI,Senior L&D Enablement Program Manager,"manager, design, system, security, training, architect, support, growth, strategy, management, content, senior, operational, digital nomad",https://remoteOK.com/remote-jobs/remote-senior-ld-enablement-program-manager-openai-1128494
2025-10-22T00:06:38+00:00,Datavant,Job,,https://remoteOK.com/remote-jobs/remote-job-datavant-1128493
2025-10-22T00:06:26+00:00,eClinical Solutions,Senior Statistical Programmer,"programmer, cloud, management, senior, analytics",https://remoteOK.com/remote-jobs/remote-senior-statistical-programmer-eclinical-solutions-1128492
2025-10-22T00:06:12+00:00,SharkNinja,Commercial Sales Analyst Midwest,"analyst, design, support, growth, sales, digital nomad",https://remoteOK.com/remote-jobs/remote-commercial-sales-analyst-midwest-sharkninja-1128491
2025-10-22T00:05:53+00:00,Pattern Data,Sales Development Representative,"operational, sales, executive",https://remoteOK.com/remote-jobs/remote-sales-development-representative-pattern-data-1128490
2025-10-22T00:05:31+00:00,Datavant,Job,,https://remoteOK.com/remote-jobs/remote-job-datavant-1128489
2025-10-22T00:05:13+00:00,Fleetio,Associate Customer Support Specialist,"technical, support, software, rails, management",https://remoteOK.com/remote-jobs/remote-associate-customer-support-specialist-fleetio-1128488
2025-10-22T00:04:56+00:00,Mom&#39;s Meals,Manager Healthcare Partnerships Medicare Advantage,"manager, salesforce, training, consulting, support, growth, travel, microsoft, leader, strategy, operational, marketing, sales, health, healthcare",https://remoteOK.com/remote-jobs/remote-manager-healthcare-partnerships-medicare-advantage-mom39s-meals-1128487
2025-10-22T00:04:48+00:00,Engine,Groups Sales Manager,"manager, support, travel, fintech, management, lead, sales, non tech",https://remoteOK.com/remote-jobs/remote-groups-sales-manager-engine-1128486
2025-10-22T00:04:27+00:00,"Contact Government Services, LLC",Customer Service Representative,"security, support, growth, web, financial, management, content, educational",https://remoteOK.com/remote-jobs/remote-customer-service-representative-contact-government-services-llc-1128485
2025-10-22T00:04:20+00:00,Electrified Thermal,Account Executive EU,"technical, support, growth, finance, lead, marketing, sales, go, engineering, executive",https://remoteOK.com/remote-jobs/remote-account-executive-eu-electrified-thermal-1128484
2025-10-22T00:04:14+00:00,Pattern Data,Account Executive,"operations, sales, executive",https://remoteOK.com/remote-jobs/remote-account-executive-pattern-data-1128483
2025-10-22T00:03:49+00:00,Firework,Manager Integration Solutions,"manager, saas, consultant, technical, support, voice, javascript, video, management, content, engineering, shopify",https://remoteOK.com/remote-jobs/remote-manager-integration-solutions-firework-1128482
2025-10-22T00:03:43+00:00,GoodLeap,Paralegal Capital Markets,"supervisor, support, developer, software, financial, finance, management, operations, legal, digital nomad",https://remoteOK.com/remote-jobs/remote-paralegal-capital-markets-goodleap-1128481
2025-10-22T00:03:36+00:00,Airalo,Sales Manager North America,"manager, technical, support, growth, director, leader, analytics, telecom, sales, recruitment, full-time",https://remoteOK.com/remote-jobs/remote-sales-manager-north-america-airalo-1128480
2025-10-22T00:03:29+00:00,Trility Consulting,Senior Delivery Consultant,"consultant, consulting, training, technical, support, software, scrum, investment, strategy, management, lead, senior",https://remoteOK.com/remote-jobs/remote-senior-delivery-consultant-trility-consulting-1128479
2025-10-22T00:03:22+00:00,Megaport,Technical Business Analyst,"analyst, system, training, technical, support, software, code, web, voice, qa, cloud, microsoft, leader, management, engineering, recruitment",https://remoteOK.com/remote-jobs/remote-technical-business-analyst-megaport-1128478
2025-10-22T00:03:15+00:00,Breezeway,Account Executive,"saas, travel, management, operations, operational, sales, executive",https://remoteOK.com/remote-jobs/remote-account-executive-breezeway-1128477
